{
  "version": "1.0",
  "kind": "erd",
  "title": "coral_ai App DB",
  "meta": {
    "source": "src/**/adapters/models.py + alembic/versions/0001_initial.py",
    "generatedBy": "create-erd skill",
    "database": "coral_ai",
    "defaultLayout": "hierarchical",
    "note": "Subset (6 of 16 tables) exercising every manifest feature."
  },
  "groups": [
    { "id": "auth", "label": "auth", "kind": "domain" },
    { "id": "chat", "label": "chat", "kind": "domain" },
    { "id": "payments", "label": "payments", "kind": "domain" },
    { "id": "subscriptions", "label": "subscriptions", "kind": "domain" },
    { "id": "text2sql", "label": "text2sql", "kind": "domain" }
  ],
  "nodes": [
    {
      "id": "users",
      "nodeType": "table",
      "label": "users",
      "group": "auth",
      "data": {
        "note": "admin-console access whitelist",
        "columns": [
          { "name": "id", "type": "serial", "nullable": false, "pk": true },
          { "name": "oauth_sub", "type": "text", "unique": true, "note": "backfilled on first login" },
          { "name": "email", "type": "text", "nullable": false, "unique": true },
          { "name": "role", "type": "text", "nullable": false, "default": "pending" },
          { "name": "created_at", "type": "timestamp", "default": "NOW()" }
        ]
      }
    },
    {
      "id": "message_data",
      "nodeType": "table",
      "label": "message_data",
      "group": "chat",
      "data": {
        "note": "UI-state side table (composite PK)",
        "columns": [
          { "name": "thread_id", "type": "text", "nullable": false, "pk": true },
          { "name": "message_id", "type": "text", "nullable": false, "pk": true },
          { "name": "kind", "type": "text", "nullable": false, "pk": true },
          { "name": "payload", "type": "jsonb", "nullable": false, "default": "'{}'::jsonb" }
        ]
      }
    },
    {
      "id": "billing_keys",
      "nodeType": "table",
      "label": "billing_keys",
      "group": "payments",
      "data": {
        "note": "payment-method token per PG",
        "columns": [
          { "name": "id", "type": "uuid", "nullable": false, "pk": true, "default": "gen_random_uuid()" },
          { "name": "customer_id", "type": "text", "nullable": false, "uniqueGroup": "bk_uq", "note": "LiteLLM customer id (soft ref)" },
          { "name": "provider", "type": "text", "nullable": false, "uniqueGroup": "bk_uq" },
          { "name": "bill_key", "type": "text", "nullable": false, "uniqueGroup": "bk_uq" },
          { "name": "revoked_at", "type": "timestamptz", "note": "NULL = active" }
        ]
      }
    },
    {
      "id": "subscriptions",
      "nodeType": "table",
      "label": "subscriptions",
      "group": "subscriptions",
      "data": {
        "note": "1 customer : 1 subscription",
        "columns": [
          { "name": "id", "type": "uuid", "nullable": false, "pk": true, "default": "gen_random_uuid()" },
          { "name": "customer_id", "type": "text", "nullable": false, "unique": true, "note": "LiteLLM customer id (soft ref)" },
          { "name": "status", "type": "text", "nullable": false },
          { "name": "billing_key_id", "type": "uuid", "fk": true },
          { "name": "created_at", "type": "timestamptz", "nullable": false, "default": "NOW()" }
        ]
      }
    },
    {
      "id": "db_connections",
      "nodeType": "table",
      "label": "db_connections",
      "group": "text2sql",
      "data": {
        "note": "external DBs that text2sql queries",
        "columns": [
          { "name": "id", "type": "serial", "nullable": false, "pk": true },
          { "name": "name", "type": "varchar(100)", "nullable": false, "uniqueGroup": "conn_uq" },
          { "name": "team_id", "type": "varchar(100)", "uniqueGroup": "conn_uq", "note": "LiteLLM team id (soft ref)" },
          { "name": "host", "type": "varchar(255)", "nullable": false },
          { "name": "password_encrypted", "type": "bytea", "nullable": false }
        ]
      }
    },
    {
      "id": "ddl_snapshot",
      "nodeType": "table",
      "label": "ddl_snapshot",
      "group": "text2sql",
      "data": {
        "note": "DDL snapshot — db_connection 1:1",
        "columns": [
          { "name": "id", "type": "serial", "nullable": false, "pk": true },
          { "name": "ddl_text", "type": "text", "nullable": false },
          { "name": "db_connection_id", "type": "integer", "fk": true, "unique": true },
          { "name": "last_updated", "type": "timestamp", "default": "NOW()" }
        ]
      }
    }
  ],
  "edges": [
    {
      "source": "subscriptions",
      "target": "billing_keys",
      "data": {
        "sourceColumn": "billing_key_id",
        "targetColumn": "id",
        "cardinality": "0..1:N",
        "onDelete": "SET NULL"
      }
    },
    {
      "source": "ddl_snapshot",
      "target": "db_connections",
      "data": {
        "sourceColumn": "db_connection_id",
        "targetColumn": "id",
        "cardinality": "0..1:0..1",
        "onDelete": "CASCADE"
      }
    }
  ]
}
